im feeling rather rotten so im not very ambitious right now	0
im updating my blog because i feel shitty	0
i never make her separate from me because i don t ever want her to feel like i m ashamed with her	0
i left with my bouquet of red and yellow tulips under my arm feeling slightly more optimistic than when i arrived	1
i was feeling a little vain when i did this one	0
i cant walk into a shop anywhere where i do not feel uncomfortable	4
i felt anger when at the end of a telephone call	3
i explain why i clung to a relationship with a boy who was in many ways immature and uncommitted despite the excitement i should have been feeling for getting accepted into the masters program at the university of virginia	1
i like to have the same breathless feeling as a reader eager to see what will happen next	1
i jest i feel grumpy tired and pre menstrual which i probably am but then again its only been a week and im about as fit as a walrus on vacation for the summer	3
i don t feel particularly agitated	4
i feel beautifully emotional knowing that these women of whom i knew just a handful were holding me and my baba on our journey	0
i pay attention it deepens into a feeling of being invaded and helpless	4
i just feel extremely comfortable with the group of people that i dont even need to hide myself	1
i find myself in the odd position of feeling supportive of	2
i was feeling as heartbroken as im sure katniss was	0
i feel a little mellow today	1
i feel like my only role now would be to tear your sails with my pessimism and discontent	0
i feel just bcoz a fight we get mad to each other n u wanna make a publicity n let the world knows about our fight	3
i feel like reds and purples are just so rich and kind of perfect	1
im not sure the feeling of loss will ever go away but it may dull to a sweet feeling of nostalgia at what i shared in this life with my dad and the luck i had to have a dad for years	0
i feel like ive gotten to know many of you through comments and emails and for that im appreciative and glad you are a part of this little space	1
i survey my own posts over the last few years and only feel pleased with vague snippets of a few of them only feel that little bits of them capture what its like to be me or someone like me in dublin in the st century	1
i also tell you in hopes that anyone who is still feeling stigmatized or ashamed of their mental health issues will let go of the stigma let go of the shame	0
i don t feel guilty like i m not going to be able to cook for him	0
i hate it when i feel fearful for absolutely no reason	4
i am feeling outraged it shows everywhere	3
i stole a book from one of my all time favorite authors and now i feel like a rotten person	0
i do feel insecure sometimes but who doesnt	4
i highly recommend visiting on a wednesday if youre able because its less crowded so you get to ask the farmers more questions without feeling rude for holding up a line	3
ive been missing him and feeling so restless at home thinking of him	4
i posted on my facebook page earlier this week ive been feeling a little grumpy and out of sorts the past few days	3
i start to feel emotional	0
i feel so cold a href http irish	3
i feel like i m defective or something for not having baby fever	0
i feel more virtuous than when i eat veggies dipped in hummus	1
i feel very honoured to be included in a magzine which prioritises health and clean living so highly im curious do any of you read magazines concerned with health and clean lifestyles such as the green parent	1
i spent the last two weeks of school feeling miserable	0
im feeling very peaceful about our wedding again now after having	1
i had been talking to coach claudia barcomb and coach ali boe for a long time and they both made me feel very welcomed at union	1
i feel if i completely hated things i d exercise my democratic right speak my mind in what ever ways possible and try to enact a change	3
i feel humiliated embarrassed or foolish i will remember that others have felt the same way because of the same kinds of things and i will be kind and helpful and accepting	0
i feel reassured that i am dealing with my diet in the right way and that all is good	1
i feel i have to agree with her even though i can imagine some rather unpleasant possible cases	0
im in such a happy mood today i feel almost delighted and i havent done anything different today then i normally have it is wonderful	1
im feeling really out of place and irritated	3
i also know that i feel nothing than a friendly affection to them too	1
i feel like i had a rather productive weekend and i cant always say that no matter how much i get done	1
im feeling insecure at the moment	4
i was feeling pretty anxious all day but my first day at work was a very good day and that helped a lot	4
i stood up to you i finally stood up to you and now i feel like im being punished if i could go back and do it again	0
i feel a little nervous i go to the gym	4
i feel like i could go into any situation and become successful because i ve been competing all my life explained schaub in an interview with the a href http bleacherreport	1
i can t stop the anxiety i feel when i m alone when i ve got no distractions	0
im trying to feel out my house style now that im living on my own and have creative carte blanche	1
i have tried to see what it would be like if i liked one of my girl friends but it has never really worked and i can only ever feel an emotional connection to them because they are my friends	0
i had every intention of doing more gardening this morning while it was still cool but i was just feeling so rotten	0
i have a good feeling about this so i am excited	1
i feel like i am just starting to understand the blessings that come from being submissive to the will of the father	0
i think about the things ive said and the stuff i have done it makes me feel disgusted in myself when i should be making you happy and smile which i was far from doing	3
i woke up yesterday monday morning feeling a little depressed	0
i feel so embarrassed	0
i spent wandering around still kinda dazed and not feeling particularly sociable but because id been in hiding for a couple for days and it was getting to be a little unhealthy i made myself go down to the cross and hang out with folks	1
i can honestly say that after each sistahs chat i feel invigorated and blessed	1
i still feel stupid to be in that class this is all cause off pbss fault	0
i feel a little stunned but can t imagine what the folks who were working in the studio up until this morning are feeling	5
i admit im feeling a little bit unloved at this point	0
i feel a bit stressed even though all the things i have going on are fun	3
im feeling pretty anxious	4
i feel shocked and sad at the fact that there are so many sick people	5
i think they have always been proponents of the idea and it is just slightly possible that his feelings for a particularly charming new england girl have brought him around to their way of thinking	1
i feel like a naughty school girl because i am falling behind	2
i am right handed however i play billiards left handed naturally so me trying to play right handed feels weird	5
i can feel that they are kind friendly and can understand my feelings	1
i were to go overseas or cross the border then i become a foreigner and will feel that way but never in my beloved land	2
i feel disgusted in any man in power who talks about electricity being a problem in his area and says even my own house has similar problems	3
i feel transcendant and splendid	1
i finally arrived home a couple of hours later feeling somewhat exhausted dehydrated and even sun burnt	0
i am feeling totally relaxed and comfy	1
i want each of you to feel my gentle embrace	2
i feel privileged in my world	1
i am not a people person but for some fuckin reason people feel that they can come bore me with their fuckin petty garbage	3
i realized my mistake and i m really feeling terrible and thinking that i shouldn t do that	0
i suppose i feel too trusting sometimes	1
i came home waiting for the shower read something which made me upset thats why i feel discontent haha	0
i woke up feeling crappy tired and fighting this feeling all day maybe it is all the pollen the barometric pressure i dont know i know i was off kilter	0
i feel like i am in paradise kissing those sweet lips make me feel like i dive into a magical world of love	1
i am feeling so happy	1
i am running at an approximate minute pace which i feel is quite acceptable	1
i feel so disappointed when my ex girlfriend doesn t call me back	0
i have a feeling that people are using it more than they need to and enjoying the feeling as it flies carefree off the tongue but that is alright with me	1
i am feeling uncertain of the merits of posting to this blog with the frequency or earnestness i had been over the previous year	4
i just plain feel envious of the self confidence they had	3
i was feeling weird the other day and it went away about minutes after i took my metformin	4
when a friend dropped a frog down my neck	3
im feeling angry at someone i do something thoughtful for her and my feelings toward her soften	3
i love neglecting this blog but sometimes i feel for my faithful readers	2
i lay in bed feeling as though i were awaiting an unwelcome visitor nevertheless i told myself i was strong and thought of good things until i felt better	0
i feel my heart is tortured by what i have done	3
i was still feeling weepy and strung out so maggie treated me to ice cream and a movie a href http www	0
i feel needy but comfortable with it i feel vulnerable but secure i feel the urge to cum hard but i get no relief	0
i journaled about my tendency to sometimes overcommit myself which can make me feel exhausted and overwhelmed	0
i started out feeling discouraged this morning	0
i feel agitated with myself that i did not foresee her frustrations earlier leading to the ending of our relationship	4
i grab it from the air its smooth frame feels cold to the touch	3
i was angry at my boyfriend who had promised to come to see me but did not because he spent the evening with his pals	3
i hate that i m sitting here at the hostel writing this and feeling so perfectly fine and than i get home and it s me and my problems and a wall	1
i do exercise i feel energetic and i am able to perform my other tasks in a very good manner	1
i looked at mabel this morning i named my left breast mabel my right one is hazel and i feel this weird mixture of anger and loss valerie wrote less than a month after her diagnosis	4
im feeling pretty disheartened by the whole thing	0
i feel that an input from me will be valued as being less potent than say that of irfan pathan	1
i feel is he generous	2
i even feel a little shaky	4
i am feeling better though i dont sound it	1
i always feel troubled when we re on the road touring living in a van or more recently in the circus buses no place to hang my hat as the song lyric has it	0
i feel our world then was a much more innocent place	1
i feel thoroughly virtuous even if the daily trip to the compost bin isn t the most pleasant experience	1
im not feeling anything suspicious really	4
i was feeling a little sentimental today	0
i feel like i know who most of them are by now and am starting to develop my likes and dislikes though i have not been keen on the snap evictions they have seemed pretty pointless the first one to go returned and the two webmates made absolutely zero impact on me so they won t be missed	1
i feel less whiney since the sun came out here in the sf area	0
made a wonderfull new friend	1
i feel almost embarrassed to mention the single redshank and common sandpiper but there again who would not want to mention the lone wood sandpiper present at the waters edge	0
i know its easy to feel a little envious of me and i cant tell you that you shouldnt	3
i would feel awful if she was here this whole time	0
i feel very mislead by someone that i really really thought i knew and liked very much so	2
i feel like we are doomed us humans	0
i am going to have to check on in just a few minutes but there is this clock up above the screen that keeps ticking down the minutes i have left so am feeling a bit frantic	4
i got the sleep but if i could choose not to be woken up by an alarm i d definitely take that over anything it makes me feel so groggy	0
ive been boring for few weeks and feeling a bit gloomy cause of the rainy days	0
i feel that this information is vital to moving on with your day and you re not complete until you read it	1
im feeling generous today heres one more you may have already seen but is good for a chuckle	2
i will feel awkward about just calling up one of these people out of the blue to hang out or rather to be familiar with them on a deeper level they are not my kith and kin	0
i don t like the feeling i get when someone is even a little bit offended by some offhand remark i ve made	3
i get it crumble but thanks for feeling the need to tell me that im the one who is fucked up	3
i am controlling the growth of this business and every time i post work for a client i feel even more determined to make it a full time business one day	1
i was pregnant with dean i spent the rest of my pregnancy feeling terrified about having another baby	4
i actually feel agitated which led to a terrible day yesterday in which i was unable to concentrate on anything and basically piddled the day away	3
i have an ed i will tell you that i know i shouldn t feel shamed of eating a protein bar for breakfast and the fact that i ate one isn t what makes me shameful it s the fact i didn t make it is what made me hang my head and tuck tail	0
i feel radiant bright accomplished and happy	1
i feel refrigerator magnets that were so popular a few years ago	1
i am feeling very touch deprived with all that has been happening	0
i am feeling apprehensive about it but also wildly excited	4
i was feeling pretty relaxed by the time i boarded the very new looking airbus and headed into the hazy sky en route to honolulu	1
i am a quiet person but what i have to say i feel is important	1
i think i started to feel a little homesick	0
i am feeling eager to start doing some work the man who works there literally says so uhm you guys want to go in back and see if we can find anything to do	1
i feel uncomfortable since i have a smaller rib cage and a bigger chest either i am spilling over the top of the tank or the elastic band support is too tight or too loose	4
im feeling reluctant to exit my freshly cleaned apartment which i stayed up cleaning late last night	4
i feel that i need to know that i can depend on myself before i put myself in the position of supporting someone else and being supported by someone else	2
im feeling rather angsty and listless	0
i try my best to love on them shed some light but i feel deeply compassionate with their problems and hurt even if its someone in the media	2
i was so uncomfortable and feeling weird feelings but wasn t sure if they were contractions since i never really felt contractions with jared until they jacked me up with pitocin	5
i feel gloomy and tired	0
i really like this person feel that the question was really asked out of a sincere place of love and concern about how to move forward in light of what the sexuality study recently a href http www	1
i would force myself to eat my normal routine clean meals a day but then i just started feeling so awful	0
i feel rather privileged to have witnessed the great man in action it really was impossible for a novice like me to work out just which one of the four identical looking riders was he	1
i feel like im at the spa getting a wonderful facial when i use them	1
i feel petty all of a sudden	3
i hope you like this more honest amp raw blog post amp if you are feeling unhappy i hope this makes you feel less alone	0
i feel slightly disgusted as well	3
i was quite surprised with the weather these past few days but im so thankful for that since i still can wear my shorts out without feeling that cold yes no kidding	3
i feel slightly relaxed being a	1
i feel shy to admit that i was struggling to haul a single computer up	4
i just went about my script of would you like mustard or sauce with that and started to feel really startled	4
i enjoy my colleagues i m not feeling very sociable today	1
im feeling and if ive liked being pregnant	2
i then feel your tender touch as you enfold me with his love	2
i lost a few people which i hate because i have a really hard time letting go of people to whom i feel loyal	2
i have had no interest at all to make any effort to meet men and when the chance arrises i then feel burdened with negative thoughts of he ll just be another idiot only after one thing	0
i feel i m being nutritionally supportive of it as well	2
i feel impatient i just post a blog entry and i feel ive gotten some words written and out into the world	3
i am trying my hardest so i can get to a place where i can join you and finally feel like i have something worthwhile to say	1
i have to admit i feel amused when i see the pti jamiat and a whole lot of others in the media try to avoid the suggestion that they are actually protesting the use of sharia in the case of raymond davis s release	1
i feel embarrassed that it got so bad	0
im feeling really bitter about this one	3
i feel brave today heading to amman and beirut by way of istanbul or i feel brave today a href http jessicadickinsongoodman	1
i had a fab christmas and an amazing new year with my family and friends and against all odds i feel very optimistic about	1
i feel like a loser everyone says they lost but i dont i know exactly where i am i just hate being here oh	0
i feel defeated but others i feel refreshed	0
i was feeling particularly vulnerable in a specific area so i began to talking to my friends and interestingly enough there was an incredible understanding of my struggle	4
i go onto the officer down memorial page and reflect on my feelings about that wonderful officer which seems to make me feel a little better	1
im with a group of people i still feel isolated and on the outside looking in	0
i feel blessed to know this family	2
i feel terrified because my landlord has not changed our locks yet	4
i am loosing out but i feel like i have have so much to share with many and if anything that is not unfortunate if anything it makes me grateful	0
i don t like eating meals that feel too virtuous	1
i left feeling pretty thrilled for the opportunity to at least throw my name in the hat	1
i feel kinda weird when andrea tries to talk to me about chris	4
i loved about ellie is that she didnt feel insulted by all the rude douche baggy things lothaire said to her because according to ellie insults only hurt when they come from somebody you respect damn straight	3
i feel was pretty triumphant	1
im enjoying my solitary confinement at home i rarely feel lonely	0
i am being over dramatic but i do feel very strongly for her and i am resolved to speak with her next chance i get	1
i really dont like quinn because i feel like she will just end up hurting barney and i hated the lame ted robin storyline	3
i feel so lousy but i shouldnt be focusing on me now	0
i cant remember ever feeling so exhausted it took trips with the car on the last day to get everything brought to the trailer	0
i wrote two years ago so many things i feel unsure of maybe	4
i feel suspicious of informality and a lack of credentials	4
i receive every month make me proud and feel appreciative	1
i feel that third situation pretty much sums up my feelings toward this title	1
i wanted to feel him in my hands and reached out to take him into my waiting eager mouth	1
i feel more gentle that way wth	2
i got home feeling hot tired and great	2
i feel more creative	1
i feel so talented i can use a computer	1
i feel unfathomably rich in having had a healthy pregnancy so far	1
i wish to know whether i should feel sympathetic towards the airline american if say their plane is on fire or their pilot has exploded or whether i should want to set them on fire if say they just decided to walk on their obligations to save money	2
i don t want them to feel so pressured	4
i still feel frightened of the world yet no where near as much as i used to	4
im not feeling mellow	1
i wake too early so i feel grumpy	3
i believe you all will come to my work place and just try to make me feel humiliated but you know what deep down in my heart i know who is the one who should be ashamed of themselves	0
i did finally get it if you didn t laugh left me feeling delighted exhausted and just so privileged	1
i was remembering this i was feeling skeptical	4
i have some pretty brazen goals and each day i feel stronger and more confident that i m going to reach my desired end result	1
i feel dirty talking to people for my personal gain	0
i sat there cold i flashed back to going to the hockey city classic and the degree weather and it feeling just as cold even though there was about a degree difference this night	3
i feel numb as i carry on and i wonder if i will get over it	0
i was somewhat coerced into this blog review so i feel a bit rushed and flustered	3
i guess i wont feel too jealous since i often do my mothering at the pool but its nice to have a husband again	3
im not sure how i feel about needing to exercise so as to maintain a pleasant demeanor	1
i feel alarmed	4
i think i wanted audiences to feel impressed inspired or entertained when i was on stage	5
i wasnt feeling well yesterday morning afternoon so i just laid in bed and ended up in the all too familiar youtube black hole	1
i have these terrible feelings that i hyped myself up to be more talented than i am	1
i do take on a half marathon challenge then i will wait and see how the body feels as to whether there will be a pb attempt or a casual kilometre shuffle	1
i couldn t help but feel pissed off at both sides of the debate and the unnecessary dichotomy itself	3
i feel like i cant be respected if i have self respect because it is so regular to now hate your self	1
i smiled at him feeling his longing and said maybe later buddy but i have to make lunch now	2
i am truly unfortunate the majority of the time i m usually drained but i obtain it hard to get from bed i really feel restless and others	4
i am feeling rather damaged	0
i said i feel ugly today	0
i left my garmin on my bike so i was going to have to do this by feel coming out of transition its amazing hearing cheers and your adrenaline is just going crazy	1
i feel so smart when i find ways to trick myself like this	1
i love to dance but often feel inhibited by my own body unsure what i am capable of hyper concerned about other people watching me and having opinions on my style or just feeling awkward as if i have no idea what i am supposed to do here	4
i feel like cards are the perfect thing to make with them	1
i feel like some heroine of some tragic manga	0
i just feel safer than working part time casual at hr	1
i was ambushed again it was apparently my fault again i feel worthless	0
i feel privileged to be a part of something so eternal and so precious to the lord jesus he shed his blood so that churches like this could exist	1
i feel wholly inadequate to the task before me	0
i have a feeling this is a bit naughty scanning an article from a magazine but i know that so many people would love to read thi	2
i see you on the pitchers mound at our little league diamond i feel so anxious for you because it looks so isolated over there	4
i feel like i am joining the masses which goes against my rebellion of the popular mentality ha i m so goth but i take peace in knowing that i am not making the same resolutions as everyone else	1
i feel disillusioned with the occult so i have come to feel a greater connection to the earth	0
i feel stupid whenever this happens	0
i come home and feel so shitty i cant bring myself to do all the work i need to do	0
i feel like my irritable sensitive combination skin has finally met it s match	3
i like it though its very over the top but makes me feel clever by association	1
i will practice meditation if i feel overwhelmed and hopefully become successful in peaceful practice	5
i feel like it was all in vain cant be right and feel this wrong this heart of mine is just	0
i hope everyone can help with charity work without feeling stressed about such things	0
i feel so guilty for putting my child in daycare	0
i get frustrated that unresolved issues from my past have had a severe negative effect on my behavior and feel he must be angry that i have not resolved them by now	3
i feel blessed beyond blessed to share my life with you each week	2
i feel devastated over things that i have lost i will remind myself to be grateful for what i still have	0
im feeling energetic	1
i have come to understand that feelings are neither positive nor negative	1
i just don t like to be asked about the reason behind my mood when i m feeling gloomy laughs	0
i feel really bothered about the lack of time i get to find inspiration	3
i used to be able to hang around talk with the cashier when i was putting away my money now i feel rushed and stressed if i take a second to fumble with the coins and put them in my purse	3
i feel frustrated or the world around me lies shattered i just go and walk in the rain so that no body could see my eyes full of tears this is the delivery system of justice as conceptualized by our courts which we are learning the hard way	3
i realized what i am passionate about helping women feel accepted and appreciated	1
i could change the emphasis and say i am stella and i m noticing i m feeling impatient	3
