i have reported feeling marginalized intimidated and or subjected to threats of retaliation	4
im not sure if im more at peace with our situation or if im just not feeling as bitter about it but in the past five months something has changed within me	3
i am feeling profoundly peaceful	1
i feel bad then for not accepting who i am	0
i have tried sorting out the area for the cat houses this lunchtime but i guess after the printer ordeal i am feeling quite uptight so it has been put on hold	4
i made that make me feel dumb and dumber	0
i have power feeling to justify their laziness and being bitchy against skinny girls	3
i feel like my sweet company is finally coming together	2
im making some more mood icons right now to let you see how i feel and think and of course its all charming	1
i feel like i am not accepted here i and bucking this force that is coming from all quarters that tells me that something is wrong with me if i am not married with children	1
i apologise if the pictures are not very good quality but if youre stuck for ideas feel free to check out the websites in the captions	1
i feel fine now even though ive just burned the dinner oops	1
i feel for this divine landmass and all the respect i bear in my heart for the greatness residing on it	1
i feel like but im not very fond of that word	2
i feel vulnerable not knowing what is to come and i feel like the rest of my life depends on today	4
i feel so damn agitated	3
i feel confident around him and i am always there if he needs help	1
i feel annoyingly isolated in the hostel with all those people talking outside the room etc	0
i feel like alcoholism is something that is widely accepted as the norm in gay culture	1
im just now realizing i didnt have a diet coke today and that makes me feel proud regardless of the other junk i consumed today	1
i also feel i have accepted my dark side and am finally realizing what of my dark side is healthy	1
i have spoken about before but the feeling is getting stronger and i am curious if others have similar thoughts	5
i feel a bit dull by it all	0
i hope it is because he understands the way i feel i hope he sees what he could miss and is putting the petty negative thoughts aside	3
i feel so blessed to be able to share it with you all	1
i feel a little virtuous doing these things but on the other hand nini s tasted better	1
i say i want to be more of people person but i feel very mellow right now	1
i pull out one of my favorite books to make myself feel miserable	0
i feel convinced that im going to shy away from whatever is really good for me	1
i feel kind of awkward about doing this here goes	0
i feel like i should not be surprised at this development	5
i am of snuffling and feeling dull	0
i need to feel creative and productive	1
i am who god has chosen to help my daughter become the woman god intended her to be even if i don t feel perfect	1
i am not feeling too bad except that my ribs are aching and i have a pulled muscle in my shoulder blade region from all my excruciating hours of hacking my lungs out last night	0
i am at the point of feeling resentful toward him and i don t want to be	3
i write this i feel oddly calm like wanting to just relax in a big chair or lay out in the sun	1
i feel really inspired	1
i do know that i tell some people if i feel that their question is sincere some of my sacred treasures	1
i can sit here and cry and feel wronged but it wont change the outcome	3
i was worried that maybe she was sleeping so well because she wasn t getting enough milk and was feeling lethargic	0
i am going to actively learn more about these genres and or practice them so i can feel what i should feel as a dancer gt fearless courageous confident phew	1
i started feeling a little stressed about leaving on time and making sure we got the getting ready pictures i wanted but everything seemed to workout perfectly	3
i feel like an ugly monster where i cannot show who i really am lest i seem weird or just plainly an outcast	0
i feel a little guilty that we have this exceptional little girl from ethiopia home and in our arms but this blog continues to surround goosey	0
i feel the need to layer on fake tan for a night out to give me a bit of colour my clothes do it for me	0
i feel a real emotional connection to the ice queen from the north now that you have revealed that inhumanity runs in her bloody family	0
i have been designing earrings for some of my customers bridesmaids which i feel honoured to do	1
i could adopt and what messages i could think about to help make me feel more peaceful more grateful and just happier right now	1
i feel quite worthless but i hear that that is pretty normal for north americans at this point	0
i don t feel well enough to cook	1
i feel so bad about it and hes stood there bewildered	0
i could feel hundreds of loving people all around the world connecting with earth it was simply beautiful	2
i feel not having a generous spirit or a forgiving nature closes me off from accepting gifts from the universe	2
i feel accepted and loved by a community of derby girls that i helped to create	1
i feel utterly disgusted with myself right now and am contemplating death every waking moment ever since she uttered those few words	3
i often feel confused as to whether i have bipolar or just a really hard core sinful nature	4
i am feeling very thankful	1
i feel privileged to have played against him	1
i read it at a time amp place where i was feeling less than perfect	1
im happy but i feel all this pressure to do one thing or another amp it makes me unhappy	0
i feel it is worthwhile to give you all a more in depth city sized if you will look at one of our cycle days	1
i was still feeling so exhausted from my workouts on monday and tuesday that all i did was go for a walk at the park for about	0
i grabbed my dog and hugged her fiercly for the next hour or so until i began to feel a bit like myself again but i havent completly shaken the feeling and have been feeling rather depressed anxious all day	4
i found myself feeling inhibited and shushing her quite a lot	0
i admit that i am jet lagged so during the daylight i feel groggy almost hung over while at night when everyone is tucked in and snoozing a light pops in my brain and i transform into the ever ready bunny	0
i often throw myself into work when i m not with them that same maxim from last week if i feel discouraged the way i move forwards is to offer encouragement to others	0
i feel a lot better about the way i wrote this bit of the code	1
i was supposed to feel sympathy for emma im afraid i failed	4
i feel inside this life is like a game sometimes then you came around me the walls just dissapeared nothing to surround me keep me from my fears im unprotected see how ive opened up youve made me trust coz ive never felt like this before im naked around you does it show	0
i have no energy to get angry or upset anymore i just feel a little resigned	0
i cant tell you how many times in the four months we have been seeing each other seriously that we have had to have serious emotional talks because one or both of us was feeling tender	2
i am feeling so emotional about your brothers arrival	0
im even feeling liked by the girls who hate pretty much everyone	2
i go through my day feeling your movements and am amazed that something so miraculous is happening in my body its like a special secret only you and i have	5
i feel is valuable and i want to share	1
i feel so unloved without you next to me but when im with you	0
i feel myself falling into the pit of buying it from her i think he s for real i m just skeptical of the women	4
i was learning to just deal with the nausea amp manage the unpleasantness of it at work trying to keep anyone from knowing but my sister told me there was no need to suffer amp feel miserable amp to call my dr for some zofran	0
im feeling greedy for right now	3
i justified in feeling slighted or am i just being ungrateful	0
i feel like it s waiting in the wings just patiently waiting for me to be distracted enough so it can take me down and take everything i love in this world away and destroy me	3
i feel like i fucked up big time but i have to protect a and myself	3
i feel like my mind is blank and empty	0
i don t feel comfortable playing games with them presenting the bad guy as really a misunderstood good guy or vice versa	1
i listen to the advice of my eating disorder will i actually feel better	1
i bought the gb iphone i got a apple store credit i feel like they were sympathetic to early buyers and responded appropriately	2
im feeling a lot more optimistic about my future	1
i feel pissed off and angry	3
i couldnt help feeling for him and this awful predicament he lives with on a daily and nightly basis and i was just so glad that once bel started to see the light he stuck it out and stood by daniel whilst no one else did including his family who im afraid i got really disgusted with	0
im feeling so completely mellow and perfect tonight	1
i feel curious because i would like to explore what is at the top of the helterskelter like plant	5
ive learned that there are angels on earth who feel me as i feel them who stand by with a loving thought a healing heart or a steady hand just as i would also offer without a moments hesitation in return always	2
i feel that the packaging is really lovely and the product itself just does everything you ask	2
i feel ive ignored it too long this year	0
i know different because i feel in your hugs and kisses that im perfect just the way i am	1
i am feeling a little more relaxed i am certainly not feeling refreshed thanks to drunk dudes who decided letting off fireworks every half an hour all night would be super fun and the fact that it s impossible to sleep in the freezing cold with a complaining toddler but i have certainly rebooted	1
i definitely feel there s some useful information here for anyone facing similar questions to those i had during this time of my life	1
i too feel a sense of melancholy for them	0
im sad if some people are unhappy about the flag for religious reasons but i know many religious people who do not feel it goes against their faith and they are very supportive	2
i don t feel brave though	1
i walked near the hotel and i felt very obvious and uneasy all the warnings about petty crime i read in the guidebook and maybe some residual from years ago left me feeling threatened	4
i feel like i m finally losing that stubborn little bit of extra stuff in my lower belly	3
i am feeling overwhelmed by trying to do it all that i think on the women before me	5
i remember feeling so frightened that i could feel emotions at that high a level	4
i feel inside coz i m so fucking horny	2
i have tested positive but i have never taken drugs and i feel innocent says martina	1
im so proud of you no words can describe the way that makes my heart feel thank you god for my supportive amazing hubbard	2
i have made about sex i feel that women enjoy sex when their body and emotions are admired and respected	2
i feel no need to work up acceptable conversation fodder	1
i had just hiked up and down a long steep hillside loaded with grass and bushes so i was feeling pretty doubtful id be able to find it	4
i really like the color scheme since it makes me feel peaceful clean and simple	1
i feels so lame	0
i personally feel that it is a very creative present and everything packed inside a brown paper bag	1
i feel so fearless in these post grieving days	1
i feel so blessed to be married to him because he loves his stepchildren	1
i dropped martin back off i was the dd i pulled in and because i was feeling exceptionally outgoing waved and talked to some of my neighbors downstairs	1
i feel more faithful than ever	1
i am feeling relieved to feel myself again	1
i sometimes feel a bit unwelcome	0
i feel complacent at the moment	1
i feel most passionate about that arouse my emotions seem to be the things i need to learn something about my emotion tells me there is a need to grow in some direction	2
i feel that it only makes you a person that i love who happened to do something that i don t find acceptable	1
i have not only not lost any yarn overs but am now done with my first lace project and feeling pretty pleased	1
i want you to know that if i become prime minister in less than a year s time i will be proud to do so as a friend of israel a jew and most of all someone who feels so proud to be part of the community gathered here today	1
i feel somewhat safe to give hosting a try	1
i don t follow too many people and i don t have too many followers however i have a feeling that the people that i am talking about may know who they are i m not trying to be rude i m just being real	3
i never feel lonely as long as people love and support my work	0
i have so much going on in my life and am constantly running like crazy i can always steal a quiet moment to acknowledge this child and the overwhelming excitement and anticipation that i feel god is truly faithful and brings everything around	2
i suspect his reasoning may simply be to lull apple into feeling complacent	1
i feel so exhausted by a	0
i prepare i feel thankful that these events touch upon so many different concerns in my poetry from language issues to pacific aesthetics from the avant garde to eco poetry	1
i met my present boyfriend on a boat trip to england we had said that we would call each other when we got back to sweden we were not going to the same town in england as soon as i walked in he called from england as he could not wait till he came home	1
i feel inspired so many thing i want to write down	1
im very hurt and i feel unimportant	0
i feel like uninstalling skype deactivateing all of my facebook amp hatena accounts since im becoming a hateful person amp i dont want to get any worse than i am right now	3
i began to feel shaky and nauseous and yearned for my connection to cairns to make up for some of the deprivation	4
i was feeling adventurous though so i went with some asian flavors of ginger and sesame oil for my salad	1
i was playing a sport in an advanced pe class and many of the people were not advanced	3
i cause extreme worry and distress ground to remember fondly you forever mary prepares to feel unfortunate time eventuallythe intense emotion have sexual lovein condescend to come she by hand puts out strength wu mouth dont let oneself cry out	0
i feel so greedy of holidays and forgetting my responsibilities	3
i mean i feel like a broke record sometimes	0
i am feeling rather heartless because i recently heard the words unconditional love and could not find it in myself	3
i feel dissatisfied and more accustomed to healing	3
im feeling doubtful about all of the patterns and colors working together but we cant be sure until everything comes together	4
i want to get back in the habit of blogging about all the cool fun things im up to but am also trying to get out of this rut of only writing about feeling shitty	0
i am still healing from having my heart broken still healing from broken dreams still doubting myself still feeling confused	4
i gents been feeling lousy over the last few weeks which ended up with a trip to the hospital last saturday which put a damper on the wedding anniversary	0
i read about him and learn about him in his interviews the more i feel like i could never deserve someone so kind and compassionate	2
i feel thats just strange on wotcs behalf	5
i take a walk in the park feeling joyful	1
i feel calm silent and protected by the definiteness of this existence	1
i want to feel assured that my life will be good and i know it will be when i trust the lord	1
i feel safe with berry	1
im feeling envious already	3
i suck up is the boring dull town and the feeling being missed by my family and bf	0
i feel like i have all these cute things but i dont feel comfortable in them and dont know how to put them together	1
i feel like an emotional cutter	0
i wake up in morning and when i go to sleep at evening i feel that seed voice in my heart that is screaming out from my empty stitched heart	0
i received the blanket i was absolutely amazed on how fluffy it is and extremely soft i really didnt think it was going to feel that amazing	5
i feel that sometimes im not talented enough	1
i feel it would be foolish and perhaps a little disrespectful to consider doing the long hilly race	0
i mention my oldest child before my youngest will her feelings be hurt	0
i woke up today feeling kind of strange	4
im sick of feeling unimportant like nobody needs me	0
i am feeling quite distressed and dejected over my battle with insomnia	4
i feel hated in cempaka	0
i do feel numb but only because i have so many fucking feels that i ve shorted out from feeling them	0
i often use disney to cheer me up when im feeling low and these past couple days have been no exception	0
ive been feeling a little defeated maybe even over looked	0
i feel shy because of what i am wearing	4
i can say is that as long as you enjoy the story it entertains you and makes you feel emotional whether it be sad happy angry disgusted or just plain horny then who really gives a damn	0
i wept while jackson slept feeling overwhelmed by the feeling that i don t want to die	4
i feel confident to be me again in personal life and right when my work life was going well with my boss slowly understanding why i continually ask for and demand we address the tough issues that cause problems with our various departments	1
i dont know whether his presence is the reason why i feel more homesick for the uk than the us or just by being here makes me miss my former home	0
i mentioned in my last blog that i have started to get the feeling that i have been pressured into studying things i do not like which has also made me into a person i might not fully be	4
i only do unwillingly and always leaves me feeling grouchy and unsettled	3
