i don t like outsourcing because i m a picky sod and usually end up feeling dissatisfied with the work of others but i have to force myself to outsource because you need to realize you can t do everything yourself	3
i feel so blessed and honored that we get to be its parents	2
i do feel welcomed but it s a little weird	1
i feel like i entertained sd all day	1
ive struggled mightily through today and even though i feel cranky and tired and unmotivated still i really am not going to be going to sleep before eleven thirty	3
i remember sitting out on the porch feeling drained and alone even as sunlight bathed my hair in warm radiance and a light breeze cooled my cheeks	0
i didnt feel i rushed things dhawan tweet script type text javascript src http platform	3
i realized i was feeling really irritated while i was saying that	3
i am balancing on my hands with my feet hanging over and it feels like pretty far and im terrified to let them drop but im totally calm at the same time hanging here	4
i feel so fucking worthless	0
i feel like a lot of men are royally fucked up and go through life wreaking havoc and end up destroying themselves in the process	3
i feel devastated that my art style can be copied	0
i feel fine about feeling well fine	1
i can only begin to feel how distraught she must be	4
i also didnt feel i could be mad at god because i know inside me that god does nothing without a purpose	3
i think we were both feeling a little drained from work as well	0
i gather supplies and start to check her progress via internal exam the head midwife prepares to start an iv and calmly asks others for more assistance i feel reassured by her calmness	1
i feel crappy i eat crappy	0
i feel more of numb now	0
i feel extremely honoured to have received such a prestigious award	1
im feeling adventurous and successful in my quest so far	1
i feel so thrilled to have three such distinguished individuals such as yourselves here	1
i figured my parents wont make me feel accepted so i stopped trying i turned to romantic relationships with men	2
i was left feeling empty	0
i feel pretty much like this scene from a href http www	1
i may not have really been feeling superior but i certainly was feeling that i had the answers wasnt i	1
i just feel are ludicrous and wasting space or so trite they should have looked at the book first and come up with something a little more original	5
i feel like a wimpy canoe floating towards a rising tsunami	4
i feel sympathetic towards her she was tired and weary and i can see how a split second doubt could make the effortless action of standing still seem like the better option	2
i start to feel unloved and unappreciated	0
i just want to know the feeling of loving and be loved	2
i feel strange talking about less serious things right now like cooking	4
i sometimes have urges to just freak out because i feel so bothered and usually nothing has caused me to feel bothered or irritated i scratch my arms when i m mad	3
i feel miserable and he doesnt care	0
i am not surprised cause its like ok when you feel crappy and it just continues for like days or so you really try to avoid getting that sickness again	0
im feeling slightly irritable today	3
i like to add things that i already completed in my day to a new list just to feel more productive when i cross them off	1
i always feel rushed during these emails which i dont like but asa este	3
i feel like now its more of sweet apple now	2
i was so impressed with the show especially for hs and i was moved by these talented kids but then again i feel very passionate about productions and music and theatre in schools so i am always happy to endorse many hs productions throughout their seasons during this time	2
i feel like i should be supporting them somehow but im not sure how	1
i have a lot going on in my life and feel overwhelmed	4
i took for granted a few weeks ago is really weird and makes me feel really agitated and frustrated	3
i also know what it feels like to be in a relationship where you feel like a burden and too much and not worth loving or pursuing and its just	2
i know what you mean about feeling agitated	4
i am feeling pressured to blog the bad	4
i feel like being sociable and just aaaah	1
i didnt feel at all deprived having it in my chai this morning	0
i was feeling very unsure of myself and at near breaking point	4
i remember leaving church feeling invigorated every sunday and tuesday night	1
i will nolonger tell anybody how i feel or what im thinking cause all it seems to do is get me more hated than i already am	0
i asked her what she meant by shes gonna feel jealous having loada of girls over me and then she said maybee i do like you a bitt	3
i feel that i am supporting the troops by demanding that we not send our young men and women into harm s way to bear arms against a country that has done nothing to threaten us at any point	2
i feel all funny sometimes	5
i am feeling crampy and cranky	3
i indicated then i was feeling quite overwhelmed with work responsibilities teaching traveling and writing	4
i just say that i am not even feeling embarrassed when i pause and rewind my dvred commercials if the breaking dawn preview comes on	0
i spend a lot of time feeling disappointed with myself for not doing a better job at attaining my goals	0
i feel stressed but i love the feeling of the calming spirit of my heavenly father and the feeling to keep working	0
i feel more thankful being greeted by many friends and families	1
i no longer feel doomed to falling into the abyss with no way out	0
i bought it at urban outfitters so it could fit mm film and have been feeling remorseful ever since	0
i just can t feel accepted	2
ive a feeling briar beagle would give me one of her disgusted looks if i even tried exercising her in these souless surroundings	3
i just need to accept to be treated like a princess everyday without feeling dumb about the situation	0
i just got up from a nap feeling really rotten so exhausted that i feel like i could just wilt onto the floor just sitting here	0
i feel very indecisive about it	4
i feel if the pressure vessel has been seriously damaged then far more radiation would have leaked he said	0
i have better things to do than to feel humiliated	0
i feel check the wonder in all that you see you ve got to get loving unconditionally	2
ive been feeling a bit melancholy	0
i believe that feeling accepted in a non judgemental way can be healing	1
i do feel stressed	0
i feel benevolent enough to buy them some peanuts and other treats	1
i feel fine class pin it button count layout horizontal pin it	1
i feel so worthless and useless these past weeks just because im a certified by stander at home	0
i feel immensely distracted by the barrage of media i receive solicit	3
ive been feeling from my adoring fans that would be teh whole like of you who are my friends here i felt brave and excited and ventrured forth with guitar in hand to a local open mic night	2
i love and captured an atmospheric feeling in their landscapes that really impressed me	5
is hand started fondling his aching cock through the fabric of his boxers and he instinctively arched his back to feel more of the delicious sensation	1
i am feeling energized productive and creative	1
i am feeling lucky to have him	1
i feel is vital to keeping my spirit young even as my body fades	1
i feel agitated and annoyed more than worried or fearful but these feelings can easily lead to being short tempered with my family and feelings of disharmony	4
i still feel scared every time i go into a strange place	4
i don t feel the author s talented	1
i feel so jaded and bored	0
im pretty sure and its been about a week and a half so although im feeling kind of betrayed and disillusioned by men at the moment everythings okay	0
i feel like ive lost my mind	0
i could feel his breath on me and smell the sweet scent of him	1
i could just take my beliefs and feelings and lock them in a safe somewhere until i get my human life squared away i and just about everyone i know would be a lot happier or perhaps not	1
i am feeling sinfully horny this sunday morning	2
i just feel like someone out there has to listen and be sympathetic and then	2
ive feeling a little blank and could think of nothing to write about which might be interesting to explore or had my mind captivated	0
i feel as the sleep drained from my head i sat up my dog nudging me for affection my wife too has been wanting affection	0
i feel to aid other women with infertility disorders this valuable individual guidance is offered for a restricted number of people	1
i remember feeling envious but then why would a young healthy person envy someone who s just barely survived	3
im still feeling very emotional	0
im in that last bit of sleep before i get up in the morning i feel like that emotional energy just waits for me	0
i know nothing is going to change even i feel very envious to these people but i cant stop feeling jealous to these people because its a human beings instinct to act so	3
im happy i feel out of energy and not very inspired to do my crafts	1
i was struck by the masculine feel of the strong graphics and deep colors in this months painting nighthawks by edward hopper	1
i feel like youre just not there some body that im trying to be affectionate with it feels like im molesting some stranger i dont even know	2
i think it s the opposite i get to feel defeated because i was doing everything possible to keep baby healthy and my sugars in check	0
i am trying not to feel bitter but how else can i feel when it seems my desire is pretty much impossible	3
i feel if i am nagged i stop caring	2
i just feel totally useless today	0
i feel honored to receive the grassroots preservation award	1
i feel contented just hearing him said that hellip	1
i am reminded of pavement yurusei yatsura and coheed and cambria without feeling offended that they have ripped them off	3
i feel no positive regard	1
im feeling a lot less ugly duckling and a lot more a href http	0
i suppose if one was feeling generous one could say i was stressed by the elevator ride	1
im feeling kind of melancholy and really want to go home and cuddle up with my boys	0
i feel like the people that i myself love want and need don t talk to me and don t connect with me anymore because they have fucked up mental health and emotional problems that i can t help contribute contain understand or encompass	3
i feel that the suffering is more than i can bear i take refuge in the lord in the blessed sacrament and i speak to him with profound silence	0
i feel afraid agn lol whats new	4
i am writing and sharing here is much more about my own story and what i believe with all my heart the world needs to know the riches we have in god than me feeling angry towards or trying to bash the people and leaders and parents	3
im feeling dazed and alot of things in my mind	5
i feel so scared when the voices from there start to speak to me	4
i feel very honoured to have been part of the bond family and very much hope i have a chance to work with them again sometime in the future	1
i feel insulted pete edochie responds to death	3
i feel but not to such a hostile extent	3
i always feel so pressured	4
i electrocuted my thumb and i cant type too well because i cant really you know feel some of my fingers as an acceptable excuse for a late paper	1
i carried my phone in my pocket and didn t feel the pull to get lost in it	0
i sit here writing this i feel unhappy inside	0
i could feel my mother s sympathetic dread as i was diagnosed	2
i get disappointed it makes me feel so rejected especially being disappointed by a loved one	0
i left there feeling brow beaten	0
i am feeling vulnerable nervous worried anxious and a bit lost	4
i was feeling defeated i usually pick things up easily this way but i just wasn t getting it	0
i am most certainly an acquired taste but lately many of those around me have seemed to feel the taste to be bitter	3
i feel i am rich because my life both real and online is filled with friends and family with whom i would not want to live without	1
i feel bad saying this because i should be happy but i dont think this way that im going is for me anymore	0
ive been feeling afraid a lot lately	4
i see momo feel shy momo hmmm gt me heyy momo	4
i feel amused looking at the little turtle who sneaked in with them	1
i purple month doesnt feel surprised in fact zhuo feng up many pupils all clear xiao her identity dont even say main star feng of young	5
i feel like there is no way out being humiliated by asa a guy i was obssessed about who played an embarrassing joke on me getting caught by tabbys wife tabby is a lover i once had who was married and i blindly fell in love with him	0
i feel like breathing is as delicate as dried rose petals sometimes	2
im thankful because i feel somewhat energetic instead of the dead fish that i would become every time every chemo	1
i feel so honored today and i want to share the emotion and my gratitude because i received a very complimentary email from someone who reads thought provoking perspectives	1
ive tried bare minerals but it makes me feel like my face is dirty	0
i feel quite passionate about and that is how old should children be to undergo beauty treatments	1
i feel like i m going to struggle and fail and suffer and be really dumb	0
im feel a little bit shy to talked to her for a second but manage myself because i saw from her eyes that theres something with this girl	4
i love that this is a place a series with no real heroes and i love that the way the couples in these books fall in love feels just as violent and crazy as the place that they call home	3
i will feel more lively and full of bounce	1
i am and always have been a very sincere nice feeling sociable compassionate helpful girl	1
i feel like an obnoxious nagging call times everyday tag alonger that he is finally sick of tolerating and is now just giving the cold shoulder	3
i loved the feeling i got during an amazing slalom run whether it was in training or in a race	1
i was feeling especially shy and awkward because i didn t know many people there	4
im still feeling a little groggy from the lack of sleep so i shall try to replenish it	0
i have been sitting at home revising today and all in all feeling quite stressed	3
i guess feelings aren t meant to be inhibited or prohibited	4
i embraced feeling thankful that the middle wall of partition had thus far been broken down	1
i began to feel very strange	4
i didn t feel pressured or constrained in my choices to behave in a particular way i just felt very busy	4
i had one of my low carb meal bars for breakfast and was feeling smug when i spotted the left over pies muffins and attractive foods	1
im going through life feeling now rather than being totally numb	0
i dont want flowers or candy but the kind of guy that knows i like thinly sliced limes in my mineral water because it makes me feel glamorous and is humored by how pretentious that is	1
i feel unprotected a class post count link href http reprogramming in process	0
i always feel really confident of my life and my choices when i go home	1
i was feeling more and more frustrated with each session he attended	3
i feel like in the last year especially i ve gone from a girl to a woman and despite how hesitant i have always been about getting older next year i will be twenty four i am surprised at how pleased i am to have done so	4
i feel attacked or insulted it is helpful to realize that the idea of attack is alive and well in my own mind	3
ive missed that feeling and ive missed being there and ive missed having something to work towards that keeps my focus on me and keeps it off of my phone and the potential trouble it can get me in	0
im feeling a bit uncomfortable with myself too	4
i know that i have it nowhere near as worse as my brethren overseas but right now i feel like im being physically emotionally and spiritually assaulted	4
i am feeling so reluctant and overwhelmed i try to think of the alternative abandoning that dream	4
i usually like sam but sometimes he gets downright whiny and i ll admit that all the mistakes he made due to sibling rivalry and pride that eventually led to the end of season kind of made me feel less tragic about the whole thing	0
i hope shes feeling generous today and treat me to japanese food or something haha have a great day	1
i am feeling a bit offended	3
i offend easily when i feel my intelligence is insulted	3
i always feel a bit awkward when i comment on someone s blog because i invariably go on rabbit trails and feel as though i ve been overstepping myself so i d like to tell you if you find yourself feeling the same way that i do not mind in the slightest	0
i feel like we may be coming to the point in the tv series where the show is incredibly popular but sadly the writers are coming to the end of their story lines and soon there will be nothing left to keep the plot a float	1
i was entertaining myself with this memory while at the same time feeling like that guy in that movie dazed and confused who says i just keep on getin older and the girls stay the same age	5
i had to continue to enforce my no playdate policy which meant i continued to feel angry twice over each day once during a horrible morning drop off and once in the afternoon when i reminded noah that no he couldnt play because of the bad drop off missing mommy	3
i woke up feeling groggy and grumpy and like the last thing i wanted to do was make dinner	0
i wake up feeling like something terrifyingly bad is bound to happen to me before i even get a chance to stick a limb outside of my covers	0
i feel god in my life more now than i ever have before and things are so wonderful right now	1
i do feel like ive been a neglectful friend but its due to the fact that i feel like a hinderance so i just stay away	0
i did not know this i could not look out upon the sea and sky without feeling mildly discontent	0
i hate feeling like this this is bullshit ok i m so done bye	1
i tasted some hari raya cookies and feeling greedy i would go and prebook their kueh makmur and tart because i know their hygiene standard and ingredients	3
i sit here feeling drained i really wonder what will i do when i reach that point	0
i buy something i go out and look at what else i didnt buy and then after a bit of comparison here and there i suddenly feel dissatisfied with my purchase	3
ive been feeling incredibly inadequate more so than usual and its gotten to a point where i almost feel paralyzed by it	0
im amazed how many men say they feel unloved if the house is messy and they have to fix their own dinner	0
i feel a restless weekend heading our way	4
i feel ugly i cover myself with a beautiful blanket in a make believe gown	0
i always said i felt so blessed to have him and today that feeling is been reassured many times	1
i cant do strappy shoes at work i just feel weird so i took these off thrifted ninewest	4
i love the fact that i look as best i can and i feel terrific because i eat right and constantly exercise	1
i decent article which i knew likely had good information because my initial response was to feel offended and want to argue despite the fact that it was talking about not doing exactly that	3
i have moments where i just feel so overwhelmed that my eyes well up with tears	4
i started feeling thankful for food for being able to enjoy such delicious things and got into cooking and baking healthy meals for my family	1
i don t want to tag people who think this is silly but if there are people out there who want to be tagged i wouldn t want to make them feel unwelcome	0
im taking is allowing me to get sleep which is wonderful but its leaving me feeling very groggy and nauseated	0
i feel an unpleasant drop in my stomach as the elevator doors open at my floor	0
i feel that this is a highly talented bunch when roling on all cyclinders	1
i feel his hand on me to stay faithful	2
i was so focused on my heavy breathing my even strides the drops of sweat on my forehead that i forgot to feel socially awkward	0
i cant help feeling this way	0
i feel like i would order carryout from if i lived in the area i am still curious to try some of their other tacos	5
i feel that i am afraid of whatever ad anything that will happen and idc is it good or bad i am just afraid and i hope god you will help me in whatever i do	4
i entered the living room i had a horrible feeling aching in the depths of my stomach	0
i feel very glad that finland s well known visual artist vesa kivinen had called me to work with him	1
i feel relatively safe normal or whatever you might call it	1
i feel bitchy saying it but i think that next saturday i just want to be alone	3
i feel very honored to have been shortlisted within the patient ambassador volunteer category which recognises members of the public and staff who provide outstanding help and support through volunteering or providing patient opinions either on a public partnership forum or on a patients panel	1
i feel quite helpless in all of this so prayer is the most effective tool i have because i have no answers and there is nothing else i can offer them right now	0
i know that you feel pretty disgusted by the nonstop lefty propaganda the ministry churns out but of the public isn t that tuned in	3
i feel complacent and satisfied	1
i ventured into fabrics amp fabrics on a whim yesterday feeling a bit nervous knowing i would be tempted beyond my comfor	4
i havent been feeling homesick knowing they were all getting together to enjoy my mums cooking did make me want a teleporter	0
i feel ugly and hated	0
i was feeling whether it be mad sad disappointed or peaceful	3
i feel as if we have a talented enough team to win some games and go deep into the tournament	1
i feel i was so innocent to have only one dream to fill my brain and to be crazy about it	1
i never feel depressed because my cancer and i have learnt to live and sleep with each other	0
i can feel the pressure falling more so on my shoulders and im feeling slightly doubtful of myself which leads to unhappy thoughts not usually like my optimistic self i must say	4
i kind of feel a little petty about this	3
i hostage negotiator on her case has her feeling hopeful about her future	1
i believe that people should choose the causes they feel passionate about and do what they can and i have no right or desire to push my own charities as more worthy than another	1
i feel privileged to be allowed into the sanctum of her studio the many different paintings and studies lining the walls morph and grow week on week	1
i grew up feeling rejected by my male peers	0
i feel like that is where i can make my most valued input and tried to do as much as possible to ensure i did an equal part in the construction	1
i described how i was feeling the feeling of being out of control and completely restless the fear of what could still happen my obsession with trying to do it all and the fact that it was just not working	4
i feel very important in my fancy room with my fancy furniture and nice view of downtown dallas	1
i wanna feel good again	1
i never feel like im not supporting	1
i want you to snap out of it and simply feel simply live laugh enjoy this life no matter how idiotic it is	0
i assumed it would feel casual	1
i will admit and it left me feeling shaken and a bit of a goose	4
i feel it is dangerous especially for the new believer who is not grounded in the word of god	3
when we rearranged furniture in our flat and got stuck in a chair	3
i am feeling stressed and more than a bit anxious	3
i persevered through the storm of rejections feeling confident that i was doing what god had called me to do	1
i was feeling comfortable in the first fight i saw things that were working for me but i m expecting a better rendall munroe because i think he might have underestimated me first time around	1
im not quite sure how she really feels about it because im pretty sure that she realizes that she is going to miss getting to watch the parade which is something she really enjoys	1
i feel somewhat fake in the group	0
i was feeling particularly pissed off and wanted to go to a party	3
i feel like im still quite bad at describing my feelings with good words and beautiful phrases	0
i feel so heartbroken over paul walker s tragic disappearance the life of someone so generous beautiful and talented should not end this way as other horrible individuals keep on living torturing assaulting and killing people	0
i feel perfectly mellow	1
i feel i have to give credit to jen mitchell for her gorgeous card a href http www	1
i am alternating between feeling thrilled to see my dads family this weekend and terrified that i will be a black sheep among their normalcy	1
i feel for my sweet boy	2
i feel about as helpless and superfluous as i did when jenn had elaine naturally	4
i thought i didnt feel anything anymore it was over it was ok well today a different story i feel him i want him my heart hurts thinking he wont be around i still want him around i guess its still valid	1
im feeling better so hopefully things start falling back into the old routine	1
i hope you feel incredibly cool now	1
i watched the news at the tv	3
i didn t really go looking for it but i can definately see where the enjorlas marius ship comes from though sadly i feel it s mostly one sided and that marius is nothing more than a rich schoolboy following his whims without thoughts to the concequences	1
i feel i should as a gracious gesture apologizing for my latest post about the osp and the rand license terms	2
i get people asking me what it feels like to be the most hated man in dallas county said assessor steve helm	0
